"NUM";"TITLE";"PRICE";"SALEPRICE";"SALEPER";"DESCRIPTION";"IMGDATA";"GAMEIMG";"URL";"VARIA"
1;"Godzilla Voxel Wars";"₩15,300";"₩13,770";"-10%";"Get ready to battle using your brain A fullfledged turnbased strategy game with a difficulty level GODZILLA";"https://cdn1.epicgames.com/spt-assets/8d0c5b1ea9254d57afd4460c6c5de7de/godzilla-voxel-wars-logo-1eivb.png?h=270&quality=medium&resize=1&w=480";"https://cdn1.epicgames.com/spt-assets/8d0c5b1ea9254d57afd4460c6c5de7de/godzilla-voxel-wars-axri9.png";"https://store.epicgames.com/ko/p/godzillawars-2c30e4";1
2;"Roboquest";"₩25,600";"₩20,480";"-20%";"로보퀘스트는 멸망한 미래 세계의 빠른 FPS 로그라이트입니다 당신은 재부팅된 수호자로 강철 궁둥짝을 걷어 찰 준비를 하세요
혼자서 혹은 친구와 함께 맞서거나 끊임없이 변화하는 환경에서 치명적인 로봇 군단을 섬멸하세요";"https://cdn1.epicgames.com/spt-assets/57efac686e694e809af4210acf71fea4/roboquest-logo-3j8c5.png?h=270&quality=medium&resize=1&w=480";"https://cdn1.epicgames.com/spt-assets/57efac686e694e809af4210acf71fea4/roboquest-video-1wzoi.jpg?h=270&quality=medium&resize=1&w=480";"https://store.epicgames.com/ko/p/roboquest-9ad17a";1
3;"Lucky Goal";"₩5,100";"₩3,060";"-40%";"Lucky Goal offers an experience of a soccer game through a thirdperson view Create or participate in an online match and show who is a better soccer player A singleplayer adventure is waiting for you to improve your gaming skills";"https://cdn1.epicgames.com/spt-assets/6666791b9d354f288ae95f6c243d45ff/lucky-goal-logo-1j7md.png?h=270&quality=medium&resize=1&w=480";"";"https://store.epicgames.com/ko/p/luckygoal-201ee6";1
4;"Immortals of Aveum™";"₩66,000";"₩39,600";"-40%";"힘을 소환하고 영원전쟁을 막고 세상을 구하세요";"https://cdn2.unrealengine.com/egs-immortalsofaveum-ascendantstudios-ic1-400x400-af15a86aac40.png?h=270&quality=medium&resize=1&w=480";"https://cdn2.unrealengine.com/egs-immortalsofaveum-ascendantstudios-g1c-000-1920x1080-1189668deaba.jpg?h=270&quality=medium&resize=1&w=480";"https://store.epicgames.com/ko/p/immortals-of-aveum";1
5;"Madden NFL 24";"₩77,000";"₩50,050";"-35%";"Madden NFL 24에서 최신 버전의 FieldSENSE를 경험하세요 더욱 현실적인 캐릭터 움직임과 똑똑해진 AI를 통해 어떤 상대든 이길 수 있다는 자신감을 가지고 게임 플레이 전략을 실행할 수 있습니다";"https://cdn2.unrealengine.com/egs-maddennfl24-tiburon-ic1-400x400-4c02cc8396ef.png?h=270&quality=medium&resize=1&w=480";"https://cdn2.unrealengine.com/egs-maddennfl24-tiburon-g1c-00a-1920x1080-77595d7ce76a.jpg?h=270&quality=medium&resize=1&w=480";"https://store.epicgames.com/ko/p/madden-nfl-24";1
6;"Prince of Persia: Sands of Time";"₩11,400";"₩2,280";"-80%";"고대 페르시아의 뜨거운 사막 한 가운데에 오래된 이야기 속에서 전해져 오는 하나의 전설이 있다 그것은 피에 의해 태어나 거짓으로 지배되는 시간으로 이야기된다 한 마법 단검이 가진 어둠의 힘에 끌리어 어느 젊은 왕자가 아름다운 왕국에서 죽음의 악마가 가진 속박을 풀기에 이르게 된다 매력적인 공주의 속임수와 시간의 모래가 가진 절대적인 힘의 도움으로 왕자는 궁전의 저주받은 방들을 되돌리고 그의 나라에 평화를 되찾는 모험을 전개한다";"https://cdn2.unrealengine.com/pers-ucs24614-logo-400x400-400x400-f6e8941b68ae.png?h=270&quality=medium&resize=1&w=480";"https://cdn2.unrealengine.com/pc-princeofpersia-1-800x533-fe4a2d61e676.jpg";"https://store.epicgames.com/ko/p/prince-of-persia-sands-of-time";1
7;"Everlasting Guilt";"₩10,200";"₩5,100";"-50%";"if youre into Doom Furi  Titan Souls this game will fulfill your needs with its FPS fastpaced gameplay that heavily focuses on Boss fights each with a unique approach that has its own mechanics and a load of enemies to unleash your anger and test your arsenal upon";"https://cdn1.epicgames.com/spt-assets/46e0b74270c740c09c5ab30f8f642ab6/everlasting-guilt-logo-1ski4.png?h=270&quality=medium&resize=1&w=480";"https://cdn1.epicgames.com/spt-assets/46e0b74270c740c09c5ab30f8f642ab6/everlasting-guilt-video-1aaic.png?h=270&quality=medium&resize=1&w=480";"https://store.epicgames.com/ko/p/everlasting-guilt-213534";1
8;"Prince of Persia: Warrior Within Standard Edition";"₩11,400";"₩2,280";"-80%";"비평가들의 극찬을 받은 Prince of Persia The Sands of Time의 후속작인 Prince of Persia Warrior Within에서 지하세계에서 벌어지는 제대로 된 칼싸움을 즐겨보세요";"https://cdn2.unrealengine.com/pop2-logo-400x400-400x400-dd93e32e0844.png?h=270&quality=medium&resize=1&w=480";"https://cdn2.unrealengine.com/0000003812-1152x850-f0734b528dcb.jpg";"https://store.epicgames.com/ko/p/prince-of-persia-warrior-within";1
9;"F1® 23";"₩77,000";"₩38,500";"-50%";"2023 FIA Formula One World Championship의 공식 비디오 게임인 EA SPORTS F1 23에서 가장 마지막에 브레이크를 밟으세요";"https://cdn2.unrealengine.com/egs-f123standardedition-codemasters-ic1-400x400-dede9d82d953.png?h=270&quality=medium&resize=1&w=480";"https://cdn2.unrealengine.com/egs-f123-codemasters-g1c-00-1920x1080-b754096b526a.jpg?h=270&quality=medium&resize=1&w=480";"https://store.epicgames.com/ko/p/f1-23";1
10;"Age of Wonders 4";"₩52,000";"₩36,400";"-30%";"나만의 판타지 세계를 지배하라 4X 전략과 턴제 전술 전투를 합친 Age of Wonders의 시스템과 함께 새로운 마법 세계를 탐험하세요 턴을 진행하는 동안 제국을 확장하며 자신의 세력을 양성하고 변모시켜야 합니다";"https://cdn2.unrealengine.com/egs-ageofwonders4-triumphstudios-ic1-400x400-8d499fa476ad.png?h=270&quality=medium&resize=1&w=480";"https://cdn2.unrealengine.com/egs-ageofwonders4premiumedition-triumphstudios-editions-g1c-00-1920x1080-d47add033bca.jpg?h=270&quality=medium&resize=1&w=480";"https://store.epicgames.com/ko/p/age-of-wonders-4";1
11;"스타워즈 제다이: 서바이버™";"₩77,000";"₩50,050";"-35%";"Respawn Entertainment와 Lucasfilm Games가 공동으로 개발한 3인칭 액션 어드벤처 게임 스타워즈 제다이 서바이버에서 칼 케스티스의 이야기가 계속 이어집니다";"https://cdn2.unrealengine.com/egs-starwarsjedisurvivor-respawnentertainment-ic1-400x400-9b72934cd58b.png?h=270&quality=medium&resize=1&w=480";"https://cdn2.unrealengine.com/egs-starwarsjedisurvivor-respawnentertainment-g1c-00-1920x1080-49c0c943d65d.jpg?h=270&quality=medium&resize=1&w=480";"https://store.epicgames.com/ko/p/star-wars-jedi-survivor";1
12;"EA SPORTS™ PGA TOUR™";"₩77,000";"₩38,500";"-50%";"EA SPORTS PGA TOUR는 메이저 대회의 중심으로 ShotLink에서 제공하는 Pure Strike의 뛰어난 골프 게임플레이를 즐길 수 있으며 세계에서 가장 특별한 골프 코스들을 이용할 수 있습니다";"https://cdn2.unrealengine.com/egs-easportspgatour-electronicartstiburon-ic1-400x400-0da83c949d75.png?h=270&quality=medium&resize=1&w=480";"https://cdn2.unrealengine.com/egs-easportspgatour-electronicartstiburon-g1c-00-1920x1080-3daaac8f111a.jpg?h=270&quality=medium&resize=1&w=480";"https://store.epicgames.com/ko/p/ea-sports-pga-tour";1
13;"크라임 보스: 록케이 시티 Crime Boss: Rockay City";"₩46,000";"₩23,000";"-50%";"크라임 보스 록케이 시티 Crime Boss Rockay City는 1인칭 슈팅 액션과 구역 전쟁을 합친 조직 범죄 게임으로 솔로로 플레이하거나 친구들과 함께 플레이할 수 있습니다 록케이 시티의 새로운 왕이 되는 것을 목표로 삼은 남자 트레비스 베이커를 플레이하며 범죄의 세계로 점차 빠져들어보세요";"https://cdn2.unrealengine.com/egs-crimebossrockaycity-ingamestudios-ic1-400x400-136aa5dbda57.png?h=270&quality=medium&resize=1&w=480";"https://cdn2.unrealengine.com/cb-update5-thumbnail-1920x1080-53c89708f575.jpg?h=270&quality=medium&resize=1&w=480";"https://store.epicgames.com/ko/p/crime-boss";1
14;"Tchia";"₩34,800";"₩22,620";"-35%";"열대풍 오픈 월드 모험 이 물리 기반 샌드박스에서 산을 오르고 하늘을 활공하며 바다에서 헤엄치고 배를 타고 아름다운 섬들을 항해하세요 주변의 동물이나 물건을 컨트롤하고 우쿨렐레로 음악을 연주하세요";"https://cdn2.unrealengine.com/egs-tchia-awaceb-ic1-400x400-e079c50a9ffc.png?h=270&quality=medium&resize=1&w=480";"https://cdn2.unrealengine.com/tchialaunchtrailer-1920x1080-f69c758fbc5a.jpg?h=270&quality=medium&resize=1&w=480";"https://store.epicgames.com/ko/p/tchia";1
15;"아우터 월드: Spacer's Choice Edition";"₩67,800";"₩44,740";"-34%";"아우터 월드 Spacers Choice Edition과 함께 Obsidian Entertainment와 Private Division이 개발한 수상 경력에 빛나는 이 RPG를 최고의 방식으로 플레이해 보세요 기본 게임과 모든 DLC를 포함하는 이 리마스터링된 걸작은 아우터 월드의 절대적인 최고 버전입니다";"https://cdn2.unrealengine.com/egs-theouterworldsspacerschoiceedition-obsidianentertainment-ic1-400x400-86c3bee5e2d2.png?h=270&quality=medium&resize=1&w=480";"https://cdn2.unrealengine.com/egs-theouterworldsspacerschoiceedition-obsidianentertainment-g1a-00-1920x1080-4bd723ac37cb.jpg";"https://store.epicgames.com/ko/p/the-outer-worlds-spacers-choice-edition";1
16;"Kerbal Space Program 2";"₩54,800";"₩43,840";"-20%";"매력적인 부품 놀라운 비주얼 완전하게 개선된 UI와 맵뷰 새로운 탐험요소로 가득찬 차세대 우주 모험을 시작해 보세요";"https://cdn2.unrealengine.com/d6fb08a5-5f80-4d37-a5ae-91aff8a4d7bf-400x400-8528247966fa.png?h=270&quality=medium&resize=1&w=480";"https://cdn2.unrealengine.com/egs-kerbalspaceprogram2-interceptgames-g1c-00-launch-1920x1080-cf1addac48b8.jpg?h=270&quality=medium&resize=1&w=480";"https://store.epicgames.com/ko/p/kerbal-space-program-2";1
17;"The Settlers®: New Allies";"₩69,000";"₩34,500";"-50%";"";"https://cdn2.unrealengine.com/egst-logo-400x400-400x400-b6a3541c815c.png?h=270&quality=medium&resize=1&w=480";"";"https://store.epicgames.com/ko/p/the-settlers";1
18;"WILD HEARTS™ Standard Edition";"₩77,000";"₩42,350";"-45%";"WILD HEARTS는 고대 기술을 이용해 자연의 힘이 깃든 거대한 짐승과 싸우는 헌팅 장르에 변화를 준 게임입니다";"https://cdn2.unrealengine.com/egs-wildhearts-koeitecmogamescoltd-ic1-400x400-c3e4c7cf64f4.png?h=270&quality=medium&resize=1&w=480";"https://cdn2.unrealengine.com/egs-wildheartsstandardedition-koeitecmogamescoltd-g1c--00-1920x1080-4650e9c82dcd.jpg?h=270&quality=medium&resize=1&w=480";"https://store.epicgames.com/ko/p/wild-hearts";1
19;"Dead Space";"₩66,000";"₩39,600";"-40%";"SF 서바이벌 호러 클래식이 그래픽 오디오 게임플레이 업그레이드를 통해 완전히 재구성되어 한층 더 몰입도 높은 경험을 선사합니다";"https://cdn2.unrealengine.com/egs-deadspace-motivestudio-ic1-400x400-06964eb642fc.png?h=270&quality=medium&resize=1&w=480";"https://cdn2.unrealengine.com/egs-deadspace-motivestudio-g1c-00-1920x1080-1efe357b850d.jpg?h=270&quality=medium&resize=1&w=480";"https://store.epicgames.com/ko/p/dead-space";1
20;"OddBallers™";"₩22,400";"₩8,960";"-60%";"OddBallers는 완전히 제정신이 아닌 멀티플레이어 파티 게임으로 매 라운드가 새롭고 황당하기 그지없는 피구의 일종입니다";"https://cdn2.unrealengine.com/oddballers-std-edition-epic-game-logo-400x400-uk-400x400-b240c01a69fd.png?h=270&quality=medium&resize=1&w=480";"https://media-cdn.epicgames.com/afc56d27772046f79e9b476dc850f9e5/afc56d27772046f79e9b476dc850f9e5-00001-thumb.png?h=270&quality=medium&resize=1&w=480";"https://store.epicgames.com/ko/p/oddballers";1
21;"Kerbal Space Program";"₩43,000";"₩10,750";"-75%";"Kerbal Space Program에서 Kerbal이라고 알려진 외계 종족의 우주 프로그램을 담당하세요 여러분은 이곳에서 다양한 부품을 이용하여 현실적인 공기 역학 및 궤도 물리학을 기반으로 비행하는 또는 비행하지 않을 수도 있겠죠 완전히 작동이 가능한 우주선을 조립해야 합니다";"https://cdn2.unrealengine.com/egs-kerbalspaceprogram-squad-ic1-400x400-fc3ebf8a29b2.png?h=270&quality=medium&resize=1&w=480";"https://cdn2.unrealengine.com/egs-kerbalspaceprogram-squad-g1a-00-1920x1080-dd700d1a999e.jpg";"https://store.epicgames.com/ko/p/kerbal-space-program";1
22;"Need for Speed™ Unbound 스탠다드 에디션";"₩77,000";"₩23,100";"-70%";"Need for Speed Unbound Vol 5에서 XP와 캐시를 획득할 수 있는 새로운 방법이 추가되었으니 Lakeshore의 거리에서 악명을 떨쳐보세요";"https://cdn2.unrealengine.com/egs-needforspeedunboundstandardedition-criteriongames-ic1-400x400-18b74eda56f3.png?h=270&quality=medium&resize=1&w=480";"https://cdn2.unrealengine.com/egs-needforspeedunbound-criteriongames-g1c-00-1920x1080-7dd031372553.jpg?h=270&quality=medium&resize=1&w=480";"https://store.epicgames.com/ko/p/need-for-speed-unbound";1
23;"톰 클랜시의 레인보우 식스 시즈";"₩22,000";"₩8,800";"-60%";"사상 최고의 FPS 중 하나 1010 GameSpot  Tom Clancys Rainbow Six Siege는 정예 위주의 현실적이며 전술 요소가 풍부한 팀 기반의 슈팅 게임으로 상대보다 뛰어난 계획을 수립 및 실현할 때 승리할 수 있는 게임입니다 게임은 5 대 5 공격팀 대 방어팀 방식으로 진행되며 파괴 가능한 환경에서 격렬한 근접전이 펼쳐집니다";"https://cdn2.unrealengine.com/logo-350x100-350x100-8a201ffb4c3d.png?h=270&quality=medium&resize=1&w=480";"";"https://store.epicgames.com/ko/p/rainbow-six-siege";1
24;"Assassin's Creed Chronicles: India";"₩11,000";"₩3,300";"-70%";"화려하게 구현된 식민지 시대의 인도에서 주인공 알바즈가 되어 25D 잠입 플레이를 통해 복수의 퀘스트를 수행해 보십시오  19세기 인도를 누비며 전설적인 랜드마크들도 확인해 보십시오  다중 살해나 차크람 같은 독특한 스킬과 무기를 활용하여 긴장감 넘치는 잠입 플레이를 즐겨 보십시오  속도감 넘치는 잠입 플레이로 새로운 공간에서 펼쳐지는 신규 모드 역시 즐겨 보십시오";"https://cdn2.unrealengine.com/acci-logo-400x400-400x400-c89378145c50.png?h=270&quality=medium&resize=1&w=480";"https://cdn2.unrealengine.com/acci-storelandscape-2560x1440-2560x1440-74cbd0ab9fe1.jpg";"https://store.epicgames.com/ko/p/assassins-creed-chronicles-india";1
25;"Assassin's Creed Chronicles: China";"₩11,000";"₩3,300";"-70%";"16세기 중국에서 명 황조를 상대로 샤오 윤의 복수극이 펼쳐집니다 25D 그래픽으로 신선한 분위기를 자아내는 잠입 플레이를 즐기십시오  승표나 착화검과 같이 독특한 장비와 전투 스킬을 지닌 암살자로 새로운 플레이를 즐기십시오  중국 형제단의 유일한 생존자 샤오 윤의 이야기를 파헤쳐 보십시오  광활한 명 제국을 누비며 옛 중국 세계를 탐험해 보십시오";"https://cdn2.unrealengine.com/accc-logo-400x400-400x400-db203e850f18.png?h=270&quality=medium&resize=1&w=480";"https://cdn2.unrealengine.com/accc-storelandscape-2560x1440-2560x1440-25d4722c577d.jpg";"https://store.epicgames.com/ko/p/assassins-creed-chronicles-china";1
26;"Assassin’s Creed® Chronicles: 러시아";"₩11,000";"₩3,300";"-70%";"25D 게임 플레이 속에서 구원을 찾아 헤매는 Nikolaï Orelov와 함께 선전 미술로 가득한 러시아로 여정을 떠나보세요  10월의 혁명 여파에서 살아남고 러시아를 여행해보세요  현대식 장비를 갖춘 암살자가 되어 긴장감을 경험해보세요  플레이 가능한 두 명의 캐릭터를 번갈아가며 경험해보세요 Nikolaï와 Anastasia의 독특한 플레이 스타일을 사용해보세요";"https://cdn2.unrealengine.com/accr-logo-400x400-400x400-6591852e8bff.png?h=270&quality=medium&resize=1&w=480";"https://cdn2.unrealengine.com/accr-storelandscape-2560x1440-2560x1440-370a27cb4ccd.jpg";"https://store.epicgames.com/ko/p/assassins-creed-chronicles-russia";1
27;"Locks Quest";"₩15,000";"₩3,000";"-80%";"Build Defenses and Battle against the Clockwork horde in this 2D Action RPG  Tower Defense hybrid Experience a gripping story which unfolds as you progress through 75 Days of warfare aided by a collection of turrets traps and special attacks";"https://cdn1.epicgames.com/spt-assets/0a3bd1bc13104c979634631e75d2f87f/locks-quest-logo-i4pxj.png?h=270&quality=medium&resize=1&w=480";"https://cdn1.epicgames.com/spt-assets/0a3bd1bc13104c979634631e75d2f87f/locks-quest-video-1wxw1.jpg?h=270&quality=medium&resize=1&w=480";"https://store.epicgames.com/ko/p/locks-quest-befcf1";1
28;"Lawn Mowing Simulator";"₩22,500";"₩7,650";"-66%";"잔디 깎기 시뮬레이터Lawn Mowing Simulator에서 대영제국의 시골 지역에서 잔디 깎기의 아름다움과 재미를 경험해 보세요 잔디 깎기 사업을 경영하면서 유명한 제조사에서 실제 라이선스를 받아 현실감 넘치는 잔디깎이를 다양하게 조종할 수 있는 유일한 시뮬레이터 게임입니다";"https://cdn1.epicgames.com/spt-assets/977ce2dee0fe437d90d2a67adf9917d8/lawn-mowing-simulator-logo-52i24.png?h=270&quality=medium&resize=1&w=480";"https://cdn1.epicgames.com/spt-assets/977ce2dee0fe437d90d2a67adf9917d8/lawn-mowing-simulator-video-1ciov.png?h=270&quality=medium&resize=1&w=480";"https://store.epicgames.com/ko/p/lawn-mowing-simulator-838bf3";1
29;"Mass Effect™ Legendary Edition";"₩66,000";"₩10,560";"-84%";"Mass Effect Legendary Edition은 수많은 호평을 받은 Mass Effect Mass Effect 2 Mass Effect 3의 모든 싱글 플레이어 기본 콘텐츠와 40가지 이상의 DLC 프로모션 무기 아머 팩 등이 모두 포함되어 있으며 4K UHD에 맞게 리마스터 및 최적화되었습니다";"https://cdn2.unrealengine.com/egs-masseffectlegendaryedition-bioware-ic1-400x400-2fb662c963a7.png?h=270&quality=medium&resize=1&w=480";"https://cdn2.unrealengine.com/egs-masseffectlegendaryedition-bioware-g1c-00-1920x1080-af81a24e209a.jpg?h=270&quality=medium&resize=1&w=480";"https://store.epicgames.com/ko/p/mass-effect-legendary-edition";1
30;"It Takes Two";"₩44,000";"₩15,400";"-65%";"It Takes Two에서 생애 가장 정신없는 여정을 시작하세요 친구가 무료로 참가할 수 있게 친구 패스로 초대하고 함께 힘을 합쳐서 수많은 유쾌하고 획기적인 게임플레이 챌린지를 헤쳐나가세요";"https://cdn2.unrealengine.com/egs-ittakestwo-hazelight-ic1-400x400-10a8bec2a659.png?h=270&quality=medium&resize=1&w=480";"https://cdn2.unrealengine.com/egs-ittakestwo-hazelight-g1c-00-1920x1080-ddefff1a1789.jpg?h=270&quality=medium&resize=1&w=480";"https://store.epicgames.com/ko/p/it-takes-two";1
31;"Battlefield V 디피니티브 에디션";"₩55,000";"₩11,000";"-80%";"최고의 Battlefield V 체험을 선사합니다 1년 차 및 2년 차로부터 무기 탑승장비 보조장비와 최고의 커스터마이징 콘텐츠를 완전히 갖추고 인류사상 가장 거대했던 갈등에 뛰어드세요";"https://cdn2.unrealengine.com/egs-battlefieldvdefinitiveedition-dice-ic1-400x400-8f2c951f2a2a.png?h=270&quality=medium&resize=1&w=480";"https://cdn2.unrealengine.com/egs-battlefieldvdefinitiveedition-dice-g1a-00-1920x1080-2a5634d98f47.jpg";"https://store.epicgames.com/ko/p/battlefield-v-definitive-edition";1
32;"The Suicide of Rachel Foster";"₩18,500";"₩1,850";"-90%";"오랜 세월 후 가족이 경영하는 호텔로 돌아온 한 젊은 여성은 과거의 망령에 사로잡히게 되고 오직 낡은 휴대 전화기만을 사용해 끔찍한 진실을 밝혀내야 합니다";"https://cdn1.epicgames.com/spt-assets/13be2d108e0344c98158bf4a2926bba5/the-suicide-of-rachel-foster-logo-13lvd.png?h=270&quality=medium&resize=1&w=480";"https://cdn1.epicgames.com/spt-assets/13be2d108e0344c98158bf4a2926bba5/the-suicide-of-rachel-foster-video-phcwo.jpg?h=270&quality=medium&resize=1&w=480";"https://store.epicgames.com/ko/p/the-suicide-of-rachel-foster-1dc01b";1
33;"Iratus: Lord of the Dead";"₩32,000";"₩4,800";"-85%";"Iratus Lord of the Dead는 턴제 전술 로그라이크 RPG로 어두운 판타지 세상을 배경으로 펼쳐집니다 언데드 군대를 통솔하여 분노한 주술사가 지상으로 도달해서 불사의 영역에 죽음을 불러오는 여정을 도와주세요";"https://cdn1.epicgames.com/spt-assets/e7bee97d9a88475487a71b456a81110f/iratus--lord-of-the-dead-logo-wvsqa.png?h=270&quality=medium&resize=1&w=480";"https://cdn1.epicgames.com/spt-assets/e7bee97d9a88475487a71b456a81110f/iratus--lord-of-the-dead-video-1kqcj.jpg?h=270&quality=medium&resize=1&w=480";"https://store.epicgames.com/ko/p/iratus-d0e5ba";1
34;"Unrailed!";"₩19,500";"₩4,870";"-75%";"Unrailed는 협동 멀티플레이어 게임으로 친구들과 함께 끊임없이 절차적으로 생성되는 세계 곳곳에 걸쳐 철도를 건설해야 합니다 이 세계에 서식하는 생명체와의 무작위적인 만남을 잘 처리하고 열차를 업그레이드하고 열차가 탈선하지 않도록 하세요";"https://cdn1.epicgames.com/spt-assets/dc57439aac3c481aaa52ccb443a4d01a/unrailed-logo-1lrnn.png?h=270&quality=medium&resize=1&w=480";"https://cdn1.epicgames.com/spt-assets/dc57439aac3c481aaa52ccb443a4d01a/unrailed-video-17udh.jpg?h=270&quality=medium&resize=1&w=480";"https://store.epicgames.com/ko/p/unrailed-e19729";1
35;"Warpips";"₩19,000";"₩3,800";"-80%";"Warpips는 매우 빠른 속도로 배울 수 있음과 동시에 놀랍도록 깊이 있는 줄다리기식 전략 게임입니다 이 치밀하고 유려한 전략 중심의 전쟁 게임에서 올바른 조합의 병사 탱크 헬리콥터 비행기를 배치해 보세요 최고의 부대를 조직하고 올바른 기술을 연구하여 적을 압도하세요";"https://cdn1.epicgames.com/spt-assets/581b8af82db34e5c98f5dae3ed5b9904/warpips-logo-tbmjs.png?h=270&quality=medium&resize=1&w=480";"https://cdn1.epicgames.com/spt-assets/581b8af82db34e5c98f5dae3ed5b9904/warpips-video-rchxl.jpg?h=270&quality=medium&resize=1&w=480";"https://store.epicgames.com/ko/p/warpips-57e2c4";1
36;"Zombie Rollerz: Pinball Heroes";"₩17,000";"₩3,400";"-80%";"Zombie Rollerz는 고전 핀볼 좀비 디펜스 로그라이크가 섞인 궁극의 혼합 게임입니다 쏘고 때리고 부수며 좀비 떼와 강력한 보스 전투를 헤쳐나가세요 영웅을 선택하세요 이제 핀볼 마법사가 될 시간입니다";"https://cdn1.epicgames.com/spt-assets/555b34e18d6d4c6d9cf89533866089cb/zombie-rollerz-logo-1yrgw.png?h=270&quality=medium&resize=1&w=480";"https://cdn1.epicgames.com/spt-assets/555b34e18d6d4c6d9cf89533866089cb/zombie-rollerz-video-6stic.jpg?h=270&quality=medium&resize=1&w=480";"https://store.epicgames.com/ko/p/zombie-rollerz-7aa027";1
37;"Sifu";"₩41,000";"₩24,600";"-40%";"Sifu는 현실감 있는 3인칭 격투 게임으로 격렬한 쿵후 전투 메커니즘과 영화 같은 무술 액션으로 복수의 길을 떠나게 되는 이야기가 펼쳐집니다";"https://cdn2.unrealengine.com/egs-greeneye-sloclap-ic1-400x400-7f5493d6af29.png?h=270&quality=medium&resize=1&w=480";"https://cdn2.unrealengine.com/egs-sifustandardedition-sloclap-g1c-00-1920x1080-9fa1849480b9.jpg?h=270&quality=medium&resize=1&w=480";"https://store.epicgames.com/ko/p/sifu";1
38;"Tom Clancy's Rainbow Six Extraction";"₩44,000";"₩11,000";"-75%";"Rainbow 팀이 이제 사상 최대의 테러 치명적인 돌연변이 외계인의 침공에 맞섭니다";"https://cdn2.unrealengine.com/en-r6e-std-epic-edition-capsule---hero-carrousel-1920x1080-uk-1920x1080-4e6c8c92082c.jpg?h=270&quality=medium&resize=1&w=480";"https://media-cdn.epicgames.com/4c3e5c73aea34b2f925cea94a4c08c03/4c3e5c73aea34b2f925cea94a4c08c03-00001-thumb.png?h=270&quality=medium&resize=1&w=480";"https://store.epicgames.com/ko/p/rainbow-six-extraction";1
39;"Iron Danger";"₩22,000";"₩2,200";"-90%";"Iron Danger는 독특한 시간 조작법으로 플레이하는 전술 전투 게임입니다 턴제 게임의 전술적인 깊이와 실시간 게임의 흥미진진한 액션이 함께 어우러져 지금까지 단 한 번도 경험해보지 못한 세계가 펼쳐집니다";"https://cdn1.epicgames.com/spt-assets/26bc65608bc84294900df1974ef3758a/iron-danger-logo-dj1na.png?h=270&quality=medium&resize=1&w=480";"https://cdn1.epicgames.com/spt-assets/26bc65608bc84294900df1974ef3758a/iron-danger-kecb1.png";"https://store.epicgames.com/ko/p/iron-danger-b4320c";1
40;"Partisans 1941";"₩45,500";"₩6,820";"-85%";"Partisans 1941은 제2차 세계 대전의 동부 전선을 배경으로 펼쳐지는 실시간 잠입 전술 게임입니다 적의 전선 후방에서 활약하는 군대 사령관이 되어 파르티잔을 모아 독일 점령군에 맞서 게릴라전을 벌이세요";"https://cdn2.unrealengine.com/egs-partisans1941-altergames-ic1-400x400-34302cc0cc14.png?h=270&quality=medium&resize=1&w=480";"https://cdn2.unrealengine.com/egs-partisans1941-altergames-g1c-00-1920x1080-1900b6203415.jpg?h=270&quality=medium&resize=1&w=480";"https://store.epicgames.com/ko/p/partisans-1941";1
