"NUM";"TITLE";"PRICE";"SALEPRICE";"SALEPER";"DESCRIPTION";"IMGDATA";"GAMEIMG";"URL";"VARIA"
41;"Tomb Raider GAME OF THE YEAR EDITION";"₩24,730";"₩4,940";"-80%";"본능만으로 인간의 한계를 뛰어넘어야 하는 라라 크로프트는 미지의 섬의 어두운 역사를 풀기 위해 싸워나가며 어둠의 손아귀로부터 탈출해야 합니다";"https://cdn2.unrealengine.com/egs-tombraidergameoftheyearedition-crystaldynamics-ic1-400x400-3e22efa0cd45-400x114-ba026833492c.png?h=270&quality=medium&resize=1&w=480";"https://cdn2.unrealengine.com/egs-tombraidergameoftheyearedition-crystaldynamics-g1c-00-1920x1080-341cc2f82785.jpg?h=270&quality=medium&resize=1&w=480";"https://store.epicgames.com/ko/p/tomb-raider";1
42;"Shadow of the Tomb Raider: Definitive Edition";"₩44,400";"₩11,100";"-75%";"Shadow of the Tomb Raider Definitive Edition에서 라라가 그녀의 운명인 툼 레이더로 단련되어 가는 이야기의 최종 챕터를 경험해보세요";"https://cdn2.unrealengine.com/egs-shadowofthetombraiderdefinitiveedition-eidosmontralcrystaldynamicsnixxessoftware-ic1-400x400-1a101c6adcf1-400x132-564f4e1cc624.png?h=270&quality=medium&resize=1&w=480";"https://cdn2.unrealengine.com/egs-shadowofthetombraiderdefinitiveedition-eidosmontralcrystaldynamicsnixxessoftware-g1c-00-1920x1080-5cb1a28a5b94.jpg?h=270&quality=medium&resize=1&w=480";"https://store.epicgames.com/ko/p/shadow-of-the-tomb-raider";1
43;"MONOPOLY Madness";"₩33,000";"₩8,250";"-75%";"모두의 사랑을 받아온 모노폴리가 새로운 모습으로 찾아왔습니다 광란의 경주를 즐겨보세요";"https://cdn2.unrealengine.com/mmad-logo-color-400x150-400x150-58bb3c821949.png?h=270&quality=medium&resize=1&w=480";"https://cdn2.unrealengine.com/monopoly-madness-standard-edition-epic-store-landscape-2560x1440-2560x1440-a7a4ee821f33.png";"https://store.epicgames.com/ko/p/monopoly-madness";1
44;"Shadow Tactics - Aiko's Choice";"₩22,000";"₩7,480";"-66%";"Aikos Choice는 인기 잠입 전술 게임 Shadow Tactics의 최신 독립형 애드온입니다 일본 에도 시대를 배경으로 펼쳐지는 이 게임에서 여러분은 고도의 쿠노이치 실력자인 Aiko와 그녀의 치명적인 암살자 동료들을 조종하여 Aiko의 과거를 추적해 갑니다";"https://cdn1.epicgames.com/spt-assets/24f4bf69387246819ea43509effb6ba4/shadow-tactics--aikos-choice-logo-19tqz.png?h=270&quality=medium&resize=1&w=480";"https://cdn1.epicgames.com/spt-assets/24f4bf69387246819ea43509effb6ba4/shadow-tactics--aikos-choice-video-16y9p.jpg?h=270&quality=medium&resize=1&w=480";"https://store.epicgames.com/ko/p/shadow-tactics-aikos-choice-5678c1";1
45;"Solar Ash Kingdom";"₩49,000";"₩24,500";"-50%";"수상 경력의 Hyper Light Drifter 제작자가 선사하는 Solar Ash의 빠른 스피드와 중력을 거스르는 세상을 만나보세요 자신의 행성이 끝없이 집어삼키는 Ultravoid의 먹이가 되지 않게 막기로 굳게 결심한 Voidrunner Rei가 되어 플레이하세요";"https://cdn2.unrealengine.com/solarash-logo-2128x1558-1623272280889-2127x1558-c63e290e0776.png?h=270&quality=medium&resize=1&w=480";"https://cdn2.unrealengine.com/solarash-keyart-landscape-egs-1920x1080-6653b006f96a.jpg?h=270&quality=medium&resize=1&w=480";"https://store.epicgames.com/ko/p/solar-ash";1
46;"Battlefield™ 2042";"₩66,000";"₩10,560";"-84%";"Battlefield 2042가 프랜차이즈의 상징인 전면전으로의 복귀를 알립니다 무질서로 변한 가까운 미래 세계의 대규모 전장에서 분대를 이루고 최첨단 무기를 사용하세요";"https://cdn2.unrealengine.com/egs-battlefield2042-dice-ic1-400x400-e32d2b25fc92.png?h=270&quality=medium&resize=1&w=480";"https://cdn2.unrealengine.com/egs-battlefield2042-dice-g1c-006-1920x1080-5587cc5df024.jpg?h=270&quality=medium&resize=1&w=480";"https://store.epicgames.com/ko/p/battlefield-2042";1
47;"Trüberbrook";"₩31,000";"₩3,100";"-90%";"1960년대 평행 우주 독일에서 흥미진진한 휴가를 즐기세요  수제작한 배경이 돋보이는 SF 미스터리 어드벤처 게임에서 젊은 미국인 과학자 Hans Tannhauser와 동행하세요";"https://cdn2.unrealengine.com/egs-trberbrook-btf-ic1-400x279-7fab7d777753.png?h=270&quality=medium&resize=1&w=480";"https://cdn2.unrealengine.com/egs-trberbrook-btf-g1c-00-1920x1080-2104b2fda325.jpg?h=270&quality=medium&resize=1&w=480";"https://store.epicgames.com/ko/p/truberbrook";1
48;"Riders Republic";"₩45,500";"₩11,370";"-75%";"다양한 프리라이드 챌린지에서 다른 라이더들과 경쟁을 펼치세요 자전거나 스키 스노보드를 타거나 윙수트를 입고 방대한 오픈 월드를 탐험하세요  해당 에디션에는 BMX 애드온과 추가 콘텐츠가 포함되어 있지 않습니다";"https://cdn2.unrealengine.com/en-mad-std-game-epic-game-logo-color-1000x375-en-1000x375-a99aa957c643.png?h=270&quality=medium&resize=1&w=480";"https://media-cdn.epicgames.com/3fa1faa8834d4d0f81a8f4fdda848b6b/3fa1faa8834d4d0f81a8f4fdda848b6b-00001-thumb.png?h=270&quality=medium&resize=1&w=480";"https://store.epicgames.com/ko/p/riders-republic";1
49;"마블의 가디언즈 오브 갤럭시";"₩69,800";"₩17,450";"-75%";"당신은 스타로드입니다 은하계와 가디언즈의 운명이 당신 손에 달렸습니다 우주에 당신이 어떤 사람인지 보여 줄 시간입니다 당신이라면 할 수 있습니다 아마도";"https://cdn2.unrealengine.com/egs-marvelsguardiansofthegalaxy-eidosmontral-ic5-400x174-478b8a5714b5.png?h=270&quality=medium&resize=1&w=480";"https://cdn2.unrealengine.com/egs-marvelsguardiansofthegalaxy-eidosmontral-g1c-accolades-1920x1080-40304ad0a770.jpg?h=270&quality=medium&resize=1&w=480";"https://store.epicgames.com/ko/p/marvels-guardians-of-the-galaxy";1
50;"Disciples: Liberation";"₩47,200";"₩23,600";"-50%";"Nevendaar 땅을 해방하고 세밀하게 묘사된 세계에 숨은 무궁무진한 이야기를 밝히세요 결정할 때마다 결과가 변하므로 잘못된 전략은 치명적일 수 있습니다";"https://cdn2.unrealengine.com/egs-disciplesliberation-frimastudio-ic1-400x400-22ae8d87480e.png?h=270&quality=medium&resize=1&w=480";"https://media-cdn.epicgames.com/3941a67f3cd64a49a9bdd989aeb0e2fd/3941a67f3cd64a49a9bdd989aeb0e2fd-00001-thumb.png?h=270&quality=medium&resize=1&w=480";"https://store.epicgames.com/ko/p/disciples-liberation";1
51;"JARS";"₩13,500";"₩3,370";"-75%";"JARS는 퍼즐과 타워 디펜스를 절묘하게 버무린 전략 게임이에요 으스스하며ㄴ서도 사랑스러운 세계 속에서 주인공 존 빅터는 지하실의 비밀을 밝히는 여정을 떠나죠 당신은 세상을 구하게 될까요 외출 금지에 처하게 될까요";"https://cdn1.epicgames.com/spt-assets/aa4e814e8db94167a3ca35871c75c846/jars-logo-1boqq.png?h=270&quality=medium&resize=1&w=480";"https://cdn1.epicgames.com/spt-assets/aa4e814e8db94167a3ca35871c75c846/jars-video-1pha2.png?h=270&quality=medium&resize=1&w=480";"https://store.epicgames.com/ko/p/jars-e39063";1
52;"War Mongrels";"₩46,000";"₩16,100";"-65%";"제 2차 세계 대전의 동부 전선에서 벌어지는 실시간 전략 아이소메트릭 게임 줄거리 중심의 캠페인은 실제로 발생한 어두운 사건들과 이러한 사건 주변의 실제 이야기들로부터 영감을 받았습니다 혼자서 또는 협동 모드에서 전쟁의 참혹함으로 뛰어드세요";"https://cdn2.unrealengine.com/egs-warmongrels-destructivecreations-ic2-128x128-d7734c9b288e.png?h=270&quality=medium&resize=1&w=480";"https://cdn2.unrealengine.com/egs-warmongrels-destructivecreations-g1c-00-1920x1080-5a4dae0e72aa.jpg?h=270&quality=medium&resize=1&w=480";"https://store.epicgames.com/ko/p/war-mongrels";1
53;"Discovery Tour: Viking Age";"₩22,000";"₩8,800";"-60%";"디스커버리 투어 바이킹의 시대에서 마치 살아있는 박물관처럼 바이킹의 세계를 생생하게 체험하십시오";"https://cdn2.unrealengine.com/uk-uk-acv-discovery-tour-epic-edition-capsule---hero-carrousel-1920x1080---1920x1080-21d2ffaf1603.jpg?h=270&quality=medium&resize=1&w=480";"https://cdn2.unrealengine.com/uk-uk-acv-discovery-tour-epic-key-art-wide-3840x2160---3840x2160-36a86c86e6b3.png";"https://store.epicgames.com/ko/p/discovery-tour-viking-age";1
54;"Rise of the Tomb Raider: 20주년 기념판";"₩59,900";"₩11,980";"-80%";"Rise of the Tomb Raider 20주년 기념판에는 기본 게임과 완전히 새로운 콘텐츠가 담긴 시즌 패스가 포함됩니다 새로운 핏줄 스토리에서 크로프트 저택을 탐험하고 라라의 악몽에서 좀비의 습격으로부터 크로프트 저택을 지키세요";"https://cdn2.unrealengine.com/egs-riseofthetombraider20yearcelebration-crystaldynamics-ic5-400x152-be59811dab66.png?h=270&quality=medium&resize=1&w=480";"https://cdn2.unrealengine.com/egs-riseofthetombraider20yearcelebration-crystaldynamics-g1c-00-1920x1080-80172a495f14.jpg?h=270&quality=medium&resize=1&w=480";"https://store.epicgames.com/ko/p/rise-of-the-tomb-raider";1
55;"HOT WHEELS UNLEASHED™";"₩51,000";"₩7,650";"-85%";"이번 기회에 Hot Wheels이 자랑하는 최고의 탈것을 모아보세요 끝내주는 트랙을 만들고 숨 막히는 레이싱의 세계로 뛰어드세요 가장 상징적이면서 인기 있는 Hot Wheels의 탈것이 여러분을 기다리고 있습니다 전속력으로 마음껏 달려 보세요";"https://cdn2.unrealengine.com/egs-hotwheelsunleashed-milestonesrl-ic5-400x234-ff9ef0614482.png?h=270&quality=medium&resize=1&w=480";"https://cdn2.unrealengine.com/egs-hotwheelsunleashed-milestonesrl-g1c-02-1920x1080-23ab491ab41f.jpg?h=270&quality=medium&resize=1&w=480";"https://store.epicgames.com/ko/p/hot-wheels-unleashed";1
56;"Flat Heroes";"₩10,000";"₩5,000";"-50%";"회피 점프 대시를 이용하여 수백 가지 멋진 레벨을 헤쳐나가세요 너무 어려운가요 친구와 함께 하세요";"https://cdn1.epicgames.com/spt-assets/a234dbd6227a4a9db5ff3cc94ddefe41/flat-heroes-logo-1smqv.png?h=270&quality=medium&resize=1&w=480";"https://cdn1.epicgames.com/spt/e9f9869d-fb9f-48c9-8152-f7f1fd52be75/flat-heroes-video-14709cea.png?h=270&quality=medium&resize=1&w=480";"https://store.epicgames.com/ko/p/flat-heroes-fec628";1
57;"Deepest Chamber";"₩13,500";"₩10,120";"-25%";"Deepest Chamber는 덱 빌딩 카드 게임으로 로그라이크 요소가 포함되어 있으며 위험이 어디에나 도사리고 있는 판타지 세계에서 펼쳐집니다 여러분이 머무는 지하 세계를 무덤으로 만들기 위해서라면 그 어떤 것도 서슴지 않고 저지르는 전투 경험으로 다져진 적의 큰 무리를 맞닥뜨리는 동안 카드를 가슴 가까이 간직하세요";"https://cdn1.epicgames.com/spt-assets/4d2a22667bb34427b431821252f0693a/deepest-chamber-logo-lpg0n.png?h=270&quality=medium&resize=1&w=480";"https://cdn1.epicgames.com/spt-assets/4d2a22667bb34427b431821252f0693a/deepest-chamber-video-1xvvf.png?h=270&quality=medium&resize=1&w=480";"https://store.epicgames.com/ko/p/deepest-chamber-f7085f";1
58;"Just Die Already";"₩15,500";"₩4,650";"-70%";"Just Die Already는 노인들이 난동판을 치고 다니는 샌드박스 게임으로 Goat Simulator의 디자이너들이 개발했습니다 당신은 늙고 화가 나 있으며 방금 양로원에서 쫓겨났습니다 하지만 당신이 벌써 죽었으면 하는 이 세상에서 도대체 어떻게 살아남을 수 있을까요";"https://cdn2.unrealengine.com/egs-justdiealready-doublemoose-ic5-400x280-56bc657aca47.png?h=270&quality=medium&resize=1&w=480";"https://cdn2.unrealengine.com/egs-justdiealready-doublemoose-g1c-00-1920x1080-98c3845f5957.jpg?h=270&quality=medium&resize=1&w=480";"https://store.epicgames.com/ko/p/just-die-already";1
59;"Aerial_Knight's Never Yield";"₩2,050";"₩610";"-70%";"Wally가 되어 플레이하세요 빼앗긴 것을 되찾은 수수께끼같은 캐릭터랍니다 적을 따돌릴 수 있을 만큼 빠른 속도를 가졌다면 다행입니다  달리고 점프하고 미끄러지거나 대시를 다양하게 조합해 곡예처럼 멋진 묘기를 부리고 닥쳐올 장애물을 피하세요";"https://cdn2.unrealengine.com/egs-aerial-knightsneveryield-aerial-knight-ic1-400x279-e8f5a26229c1.png?h=270&quality=medium&resize=1&w=480";"https://cdn2.unrealengine.com/egs-aerial-knightsneveryield-aerial-knight-s1-2560x1440-4b57f17dccb9.jpg";"https://store.epicgames.com/ko/p/aerial-knights-never-yield";1
60;"MotoGP™21";"₩34,800";"₩5,220";"-85%";"스타팅 그리드에서 자리를 잡고 넘치는 생동감과 높은 몰입도를 자랑하는 독보적인 비디오 게임인 MotoGP를 경험해보세요 새로워진 MotoGP21로 진정한 2륜의 레이싱 경험을 즐겨보세요";"https://cdn2.unrealengine.com/egs-motogp21-milestonesrl-ic1-400x400-4889b2fcd777.png?h=270&quality=medium&resize=1&w=480";"https://media-cdn.epicgames.com/bf4cdfe43bea4f378b56149f2ec3ca6d/bf4cdfe43bea4f378b56149f2ec3ca6d-00001-thumb.png?h=270&quality=medium&resize=1&w=480";"https://store.epicgames.com/ko/p/motogp-21";1
61;"Deponia: The Complete Journey";"₩37,000";"₩3,700";"-90%";"쓰레기 쓰레기 또 쓰레기 쓰레기 행성 Deponia에서의 삶은 결코 쉽지 않습니다 Rufus가 그 삶에 질려 이 암울한 장소에서 탈출하기 위한 계획을 하나둘씩 만들고 있는 것도 당연합니다";"https://cdn2.unrealengine.com/egs-deponiathecompletejourney-daedalicentertainment-ic1-400x400-1c30f33c5ca4.png?h=270&quality=medium&resize=1&w=480";"https://cdn2.unrealengine.com/egs-deponiathecompletejourney-daedalicentertainment-g1a-01-1920x1080-d8f3bab974fa.jpg";"https://store.epicgames.com/ko/p/deponia-the-complete-journey";1
62;"Ken Follett's The Pillars of the Earth";"₩25,000";"₩2,500";"-90%";"12세기 영국 빈곤과 전쟁의 시대 한 작은 마을에서 주민들의 안전을 위해 성당을 건설하기 시작합니다 생존을 위한 투쟁에서 여러 운명이 서로 뒤엉킵니다 켄 폴릿의 세계적인 베스트셀러 대지의 기둥이 원작입니다";"https://cdn2.unrealengine.com/egs-kenfollettsthepillarsoftheearth-daedalicentertainment-ic1-200x200-25ef8ddfbb96.png?h=270&quality=medium&resize=1&w=480";"https://cdn2.unrealengine.com/egs-kenfollettsthepillarsoftheearth-daedalicentertainment-g1c-00-1920x1080-987141afa372.jpg?h=270&quality=medium&resize=1&w=480";"https://store.epicgames.com/ko/p/ken-follets-the-pillars-of-the-earth";1
63;"Splinter Cell Chaos Theory";"₩11,000";"₩2,750";"-75%";"The year is 2008 Citywide blackouts  stock exchange sabotage  electronic hijacking of national defense systems  this is information warfare";"https://cdn2.unrealengine.com/game-logo-color-400x150-400x150-32cb58942f57.png?h=270&quality=medium&resize=1&w=480";"https://cdn2.unrealengine.com/scct-store-landscape-2560x1440-2560x1440-49faa8563ef1.jpg";"https://store.epicgames.com/ko/p/splinter-cell-chaos-theory";1
64;"Spacebase Startopia - Standard Edition";"₩47,200";"₩14,160";"-70%";"SPACEBASE STARTOPIA는 경영 시뮬레이션 및 제국 건설 전략을 전통적인 RTS 전투와 혼합하여 플레이어를 사로잡습니다 싱글 플레이어 캠페인과 Skirmish스쿼미시 모드 외에도 경쟁 모드와 4명까지의 플레이어가 함께 플레이할 수 있는 협동 멀티플레이어 모드도 포함되어 있습니다 3개의 Space Station Deck을 지키고 8개 종족의 외계인을 즐겁게 해주고 침입하는 적들을 상대로 방어하는 일 등이 마치 별일이 아닌 듯 이 역동적인 내레이터 AI가 벌어지는 일들을 전혀 어울리지 않는 어투로 중계합니다  이 게임은 여전히 개발 중입니다 시간이 지나면서 변할 수도 있고 변하지 않을 수도 있고 어쩌면 최종 게임 버전이 출시될 수도 있죠 아직 마치지 않은 현재 상태의 게임을 구매하는 것이 그다지 신경 쓰이지 않는 분들만 구매하세요";"https://cdn2.unrealengine.com/egs-spacebasestartopiastandardedition-realmforgestudios-ic1-400x156-140f0021fef5.png?h=270&quality=medium&resize=1&w=480";"https://media-cdn.epicgames.com/a20a8ad01f6c47fbb6c67a3fe2eb194e/a20a8ad01f6c47fbb6c67a3fe2eb194e-00001-thumb.png?h=270&quality=medium&resize=1&w=480";"https://store.epicgames.com/ko/p/spacebase-startopia";1
65;"Anno 2070";"₩33,000";"₩8,250";"-75%";"미래의 사회를 건설하고 섬에 정착하고 다수의 건물 차량 및 자원을 관리하여 번영하는 거대도시를 만드십시오";"https://cdn2.unrealengine.com/gamename-logo-color-1000x375-1000x375-f9164d7e71ce.png?h=270&quality=medium&resize=1&w=480";"https://cdn2.unrealengine.com/an70-ucs15626-store-landscape-2560x1440-2560x1440-c0e195591b06.jpg";"https://store.epicgames.com/ko/p/anno-2070";1
66;"Rayman Origins";"₩11,000";"₩3,300";"-70%";"Rayman Origins를 통해 전 세계 수백만 명의 팬들을 사로잡은 마법 같은 세계와 전설적인 2D 게임플레이를 만나보십시오";"https://cdn2.unrealengine.com/game-logo-color-400x150-400x150-267d0e8c0d4c.png?h=270&quality=medium&resize=1&w=480";"https://cdn2.unrealengine.com/rayl-store-landscape-2560x1440-2560x1440-b43008c9c55b.jpg";"https://store.epicgames.com/ko/p/rayman-origins";1
67;"STAR WARS™ Battlefront™ 얼티메이트 에디션";"₩24,000";"₩8,400";"-65%";"STAR WARS Battlefront 얼티메이트 에디션에서는 아주 신나는 4가지 확장팩 추가 무기 그리고 감정표현들을 포함하여 팬들의 STAR WARS 전투 판타지를 실현할 수 있는 모든 것들을 만나볼 수 있습니다";"https://cdn2.unrealengine.com/egs-starwarsbattlefrontultimateedition-dice-ic1-400x400-1ce241db7135.png?h=270&quality=medium&resize=1&w=480";"https://cdn2.unrealengine.com/egs-starwarsbattlefrontultimateedition-dice-s1-2560x1440-76ef694c4f0c.jpg";"https://store.epicgames.com/ko/p/star-wars-battlefront";1
68;"STAR WARS™ Battlefront™ II: Celebration 에디션";"₩47,000";"₩11,750";"-75%";"STAR WARS Battlefront II Celebration 에디션의 온라인 및 오프라인 모드에서 블라스터 광선검 및 포스의 숙련도를 시험해보세요";"https://cdn2.unrealengine.com/egs-starwarsbattlefrontiicelebrationedition-dice-ic1-400x400-664fe15f870c.png?h=270&quality=medium&resize=1&w=480";"https://cdn2.unrealengine.com/egs-starwarsbattlefrontiicelebrationedition-dice-g1a-01-1920x1080-87971829e831.jpg";"https://store.epicgames.com/ko/p/star-wars-battlefront-2";1
69;"Scott Pilgrim vs. The World: The Game – 컴플리트 에디션";"₩16,500";"₩5,440";"-67%";"유명 그래픽 노블 시리즈이자 영화인 Scott Pilgrim Vs The World가 클래식한 2D 아케이드 스타일의 격투 게임으로 재탄생합니다";"https://cdn2.unrealengine.com/scottpilgrim-game-logo-color-400x150-400x150-952048441.png?h=270&quality=medium&resize=1&w=480";"https://media-cdn.epicgames.com/98ea92b03ce84236b6256361f7e1a590/98ea92b03ce84236b6256361f7e1a590-00001-thumb.png?h=270&quality=medium&resize=1&w=480";"https://store.epicgames.com/ko/p/scott-pilgrim-vs-the-world-the-game";1
70;"Tropico 6";"₩47,200";"₩18,880";"-60%";"대통령이 돌아왔습니다 섬나라 Tropico에서 모두가 두려워하는 독재자가 되거나 아니면 평화를 사랑하는 정치가가 되어 자신의 역량을 증명하고 네 가지 독특한 시대에서 나만의 바나나 공화국 운명을 개척하세요";"https://cdn2.unrealengine.com/egs-tropico6-limbicentertainment-ic1-400x150-555630783.png?h=270&quality=medium&resize=1&w=480";"https://media-cdn.epicgames.com/6156e48382e847f2a32d9c96cdca1177/6156e48382e847f2a32d9c96cdca1177-00001-thumb.png?h=270&quality=medium&resize=1&w=480";"https://store.epicgames.com/ko/p/tropico-6";1
71;"Tropico 5";"₩23,600";"₩11,800";"-50%";"비평가들의 극찬을 받으며 엄청난 인기를 누리는 독재자 시뮬레이션 시리즈의 다음 에피소드에서 외딴 Tropico 섬으로 돌아가세요 식민시대 초부터 21세기 이후까지 여러분의 통치 시대를 확장하세요";"https://cdn2.unrealengine.com/egs-tropico5-haemimontgames-ic1-400x224-553842229.png?h=270&quality=medium&resize=1&w=480";"https://media-cdn.epicgames.com/bca4c332ffd747c2844c94725e272e39/bca4c332ffd747c2844c94725e272e39-00001-thumb.png?h=270&quality=medium&resize=1&w=480";"https://store.epicgames.com/ko/p/tropico-5";1
72;"Immortals Fenyx Rising 스탠다드 에디션";"₩65,000";"₩9,750";"-85%";"Immortals Fenyx Rising에서 웅장한 신화 속 모험이 현실이 됩니다 피닉스가 되어 그리스 신들을 지키기 위한 과업을 완수하세요";"https://cdn2.unrealengine.com/epic-std-game-logo-bright-uk-1000x375-952059816.png?h=270&quality=medium&resize=1&w=480";"https://media-cdn.epicgames.com/d59e544f420a4a5ea01a2ee1b0307a90/d59e544f420a4a5ea01a2ee1b0307a90-00001-thumb.png?h=270&quality=medium&resize=1&w=480";"https://store.epicgames.com/ko/p/immortals-fenyx-rising";1
73;"Bridge Constructor: The Walking Dead";"₩10,500";"₩2,100";"-80%";"최강의 콜라보를 기대하세요 Bridge Constructor The Walking Dead에서 Bridge Constructor의 전설적이고 도전 욕구를 불러일으키는 퍼즐 게임플레이와 워커가 등장하는 AMC The Walking Dead의 포스트 아포칼립스 유니버스가 만났습니다";"https://cdn2.unrealengine.com/egs-bridgeconstructorthewalkingdead-clockstonesoftware-ic1-400x132-452929190.png?h=270&quality=medium&resize=1&w=480";"";"https://store.epicgames.com/ko/p/bridge-constructor-the-walking-dead";1
74;"Assassin's Creed Valhalla 스탠다드 에디션";"₩65,000";"₩16,250";"-75%";"전설적인 바이킹 습격자로 명성을 위해 싸우십시오 적들을 습격하고 정착지를 개척하고 정치적인 역량을 키워나가야 합니다";"https://cdn2.unrealengine.com/Diesel%2Fproductv2%2Fassassins-creed-valhalla%2Fhome%2FAC-KINGDOM-PREORDER_STANDARD-EDITION_EPIC_Game_Logo_whiteblue_1000x375-1000x375-baa332e9500ef71697f4a31924488fe309c4784d.png?h=270&quality=medium&resize=1&w=480";"https://media-cdn.epicgames.com/23422ec7a580462eb27a5075c68ae401/23422ec7a580462eb27a5075c68ae401-00001-thumb.png?h=270&quality=medium&resize=1&w=480";"https://store.epicgames.com/ko/p/assassins-creed-valhalla";1
75;"The Pathless";"₩49,000";"₩19,600";"-60%";"";"https://cdn2.unrealengine.com/Diesel%2Fproduct%2Fgeum%2Fhome%2FThePathlessLogoWhite-1800x456-279813a2636e1d49315d158a5e4b89b3085ad637.png?h=270&quality=medium&resize=1&w=480";"https://media-cdn.epicgames.com/14a0aa97edb04bf4914d400dbde29f97/14a0aa97edb04bf4914d400dbde29f97-00001-thumb.png?h=270&quality=medium&resize=1&w=480";"https://store.epicgames.com/ko/p/the-pathless";1
76;"Dungeons 3";"₩35,400";"₩8,850";"-75%";"Dungeons 3은 인기 전략 게임 던전 시리즈의 최신 시리즈입니다 나만의 던전을 짓고 관리하고 괴물들을 모집하여 기묘한 덫을 놓아보세요 이 포괄적인 스토리 캠페인에서 광대한 오버월드를 정복할 야망을 가져보세요";"https://cdn2.unrealengine.com/egs-dungeons3-realmforgestudios-ic1-400x400-156727434.png?h=270&quality=medium&resize=1&w=480";"https://media-cdn.epicgames.com/28e42918189d4963b5cc482ada224128/28e42918189d4963b5cc482ada224128-00001-thumb.png?h=270&quality=medium&resize=1&w=480";"https://store.epicgames.com/ko/p/dungeons-3";1
77;"Watch Dogs: Legion Standard Edition";"₩65,000";"₩9,750";"-85%";"Watch Dogs Legion에서 가능한 모든 인력을 포섭해가며 레지스탕스를 결성하십시오";"https://cdn2.unrealengine.com/Diesel%2Fproduct%2Fhawk%2Fhome%2FGame_Logo_Color_1000x375-1000x375-94f2d7f7fd84d184525764206e17b9da99570029.png?h=270&quality=medium&resize=1&w=480";"https://media-cdn.epicgames.com/eb814f9058aa422cb0214f1f8f911e7c/eb814f9058aa422cb0214f1f8f911e7c-00001-thumb.png?h=270&quality=medium&resize=1&w=480";"https://store.epicgames.com/ko/p/watch-dogs-legion";1
78;"I Am Dead";"₩24,500";"₩9,800";"-60%";"I Am Dead는 Hohokum과 Wilmots Warehouse의 제작자가 개발한 내세와 Shelmerston 섬을 탐험하는 매력적인 퍼즐 어드벤처 게임입니다";"https://cdn2.unrealengine.com/egs-iamdead-hollowponds-ic1-400x400-097873835.png?h=270&quality=medium&resize=1&w=480";"https://cdn2.unrealengine.com/egs-iamdead-hollowponds-g1a-00-1920x1080-097874141.jpg";"https://store.epicgames.com/ko/p/i-am-dead";1
79;"Assassin's Creed II Standard Edition";"₩11,000";"₩2,750";"-75%";"순수하지만 잔인한 르네상스 시대 이탈리아를 배경으로 펼쳐지는 복수와 음모를 담은 한 가문의 서사시";"https://cdn2.unrealengine.com/Diesel%2Fproductv2%2Fassassins-creed-2%2Fhome%2FGameName_Logo_Color_1000x375-1000x375-35a61d94c83f0413a12d0e90d406e726635f6223.png?h=270&quality=medium&resize=1&w=480";"https://cdn2.unrealengine.com/ac2-gamename-store-landscape-2560x1440-2560x1440-aa944fa0e8c6.jpg";"https://store.epicgames.com/ko/p/assassins-creed-2";1
80;"스타워즈™: 스쿼드론";"₩47,000";"₩4,700";"-90%";"스타워즈 스쿼드론에서 사실적인 파일럿 경험을 통해 스타파이터 전투의 기술을 마스터하세요 조종석에 앉아 당신의 편대원들과 1인칭 멀티플레이어 우주전을 느껴 보세요 스릴 넘치는 스타워즈 싱글플레이어 스토리에서 파일럿이 되어볼 수 있습니다";"https://cdn2.unrealengine.com/Diesel%2Fproductv2%2Fstar-wars-squadrons%2Fhome%2FMAV_EPIC_PRODUCT-LOGO-400x146-7fa029488a9b3fcc956259b04736a68ce612c28c.png?h=270&quality=medium&resize=1&w=480";"https://media-cdn.epicgames.com/2258ba2c6ebf4b47984793bbdfbb4cd0/2258ba2c6ebf4b47984793bbdfbb4cd0-00001-thumb.png?h=270&quality=medium&resize=1&w=480";"https://store.epicgames.com/ko/p/star-wars-squadrons";1
